{
  "id": "fuku-2025-0001-en",
  "lang": "en",
  "title": "The Origin Is Margin",
  "tags": [
    "origin",
    "void",
    "possibility",
    "bridge"
  ],
  "body": [
    {
      "t": "Proposition",
      "v": "The origin does not appear as a finished line, but as a margin."
    },
    {
      "t": "Definition",
      "v": "Here, 'margin' does not mean a mere lack or blank space, but a state in which the next order to be drawn has not yet been inscribed."
    },
    {
      "t": "Auxiliary Line",
      "v": "Anxiety and hesitation are not to be eliminated. Rather, they serve as indicators that mark the boundaries for the next decision."
    },
    {
      "t": "Metaphor",
      "v": "A sheet of paper filled with writing has no room for new lines. Margin itself is the passage toward the future."
    },
    {
      "t": "Counterargument",
      "v": "Margin can sometimes give rise to stagnation or idleness. Yet once stagnation is recognized, it already functions as an observation point of change."
    }
  ],
  "source": {
    "author": "Yoshioka Yutaka",
    "project": "FUKU-Protocol",
    "license": "CC-BY-4.0",
    "url": "https://github.com/yoshiokayutaka"
  },
  "links": [
    {
      "rel": "mirror",
      "id": "fuku-2025-0001-ja"
    },
    {
      "rel": "next",
      "id": "fuku-2025-0002"
    }
  ],
  "v": 1
}
